{"category":"personal-experience","classification_suggestion":"personal","confidence":"medium","contradiction_refs":[],"derivation":"body-occurrence","evidence_refs":["10000000-0000-4000-8000-000000000030"],"proposal_kind":"assert","statement":"Synthetic DM-032 proposal","uncertainty_labels":["model-generated"],"warnings":[]}
